signoff_id,review_role,review_domain,required_evidence_paths,decision_status,release_allowed,clinical_use_allowed,signoff_required,blocking_condition,next_action
assay_owner_scope_review,assay_owner,scope_and_intended_use,results/clinicalization/clinical_assay_boundaries_summary.json;results/clinicalization/clinical_validation_evidence_link_summary.json,pending,no,no,yes,intended_use_and_report_language_not_approved,Assign assay owner only after validation evidence package is complete.
bioinformatics_owner_review,bioinformatics_owner,workflow_and_reproducibility,results/clinicalization/clinical_change_control_summary.json;results/clinicalization/known_answer_benchmark_plan_summary.json,pending,no,no,yes,workflow_reproducibility_and_change_control_not_validated,Assign bioinformatics owner review after approved benchmark execution and frozen workflow evidence.
clinical_scientist_accuracy_review,clinical_scientist,accuracy_and_reportable_range,results/clinicalization/clinical_validation_evidence_link_summary.json;results/clinicalization/clinical_qc_threshold_lock_summary.json,pending,no,no,yes,accuracy_thresholds_and_reportable_range_not_locked,Assign clinical scientist review after known-answer concordance and thresholds are locked.
quality_reviewer_review,quality_reviewer,validation_packet_and_change_control,results/clinicalization/clinical_validation_packet_readiness_summary.json;results/clinicalization/clinical_change_control_summary.json,pending,no,no,yes,validation_packet_template_only_and_change_control_not_released,Assign quality review after validation packet sections are evidence-complete.
laboratory_director_release,laboratory_director,final_release_decision,results/clinicalization/clinical_validation_packet_readiness_summary.json;results/clinicalization/clinical_validation_evidence_link_summary.json;results/clinicalization/clinical_change_control_summary.json,pending,no,no,yes,no_completed_validation_packet_or_prior_role_approvals,Do not request lab-director release until all prerequisite reviews are approved.
